{
  "name": "split_lines",
  "version": "1.0.0",
  "description": "Split a multi-line string into an array of individual lines",
  "tools": [
    {
      "name": "split_lines",
      "description": "Split a multi-line string into an array of individual lines",
      "command": "split",
      "inputMode": "args"
    }
  ],
  "prompts": []
}
