{
  "name": "bash",
  "version": "1.0.0",
  "description": "Built-in bash command execution with timeout and working directory support",
  "tools": [
    {
      "name": "bash",
      "description": "Executes a given bash command in a persistent shell session with optional timeout, ensuring proper handling and security measures.\n\nBe aware: OS: linux, Shell: bash\n\nIMPORTANT: This tool is for terminal operations like git, npm, docker, etc. DO NOT use it for file operations (reading, writing, editing, searching, finding files) - use the specialized tools for this instead.\n\nBefore executing the command, please follow these steps:\n\n1. Directory Verification:\n   - If the command will create new directories or files, first use `ls` to verify the parent directory exists and is the correct location\n\n2. Command Execution:\n   - Always quote file paths that contain spaces with double quotes\n   - After ensuring proper quoting, execute the command.\n   - Capture the output.\n\nUsage notes:\n- The command argument is required.\n- You can specify an optional timeout in milliseconds.\n- If the output exceeds 2000 lines or 51200 bytes, it will be truncated and the full output will be written to a file.\n- Avoid using Bash with `find`, `grep`, `cat`, `head`, `tail`, `sed`, `awk`, or `echo` commands, unless explicitly instructed or when these commands are truly necessary for the task. Instead, always prefer using the dedicated tools for these commands.\n- When issuing multiple commands, if the commands are independent and can run in parallel, make multiple bash tool calls in a single message.",
      "systemTool": true
    }
  ],
  "prompts": []
}
