{
  "name": "system-design",
  "version": "1.0.0",
  "description": "Specification-driven system design with C4/sequence diagrams, class specs, D3 animations, and test plans",
  "tools": [
    {
      "name": "extract_artifacts",
      "description": "Extract mermaid fenced blocks and D3 HTML from .spec.md files to .artifacts/",
      "command": "bash scripts/extract_artifacts.sh",
      "inputMode": "args",
      "dockerImage": "ubuntu:22.04",
      "aptDependencies": ["bash", "coreutils"]
    },
    {
      "name": "test_artifacts",
      "description": "Render mermaid diagrams to PNG and capture D3 animation filmstrip",
      "command": "bash scripts/test_artifacts.sh",
      "inputMode": "args",
      "dockerImage": "ubuntu:22.04",
      "aptDependencies": ["nodejs", "npm"]
    },
    {
      "name": "validate_all",
      "description": "Run extract + test on all .spec.md files in the project",
      "command": "bash scripts/validate_all.sh",
      "inputMode": "args",
      "dockerImage": "ubuntu:22.04"
    },
    {
      "name": "verify_artifact",
      "description": "Assert D3 keyframe DOM state matches ANIMATION_VERIFICATION",
      "command": "bash scripts/verify_artifact.sh",
      "inputMode": "args",
      "dockerImage": "ubuntu:22.04"
    },
    {
      "name": "check_artifacts",
      "description": "Scan artifact metadata for MISSING/STALE review entries",
      "command": "bash scripts/check_artifacts.sh",
      "inputMode": "args",
      "dockerImage": "ubuntu:22.04"
    }
  ],
  "prompts": [
    {
      "name": "system_design_base",
      "description": "Persona and general guidelines for specification-driven design",
      "promptFile": "prompts/system_design_base.md"
    },
    {
      "name": "load_spec",
      "description": "Load the project's spec tree into context",
      "chain": ["system_design_base"],
      "dependencies": ["system:glob", "system:read"],
      "promptFile": "prompts/load_spec.md"
    },
    {
      "name": "generate_sequence_diagram",
      "description": "Generate a Mermaid sequence diagram for the system data flow",
      "chain": ["system_design_base"],
      "dependencies": ["validate_all", "system:read", "system:write"],
      "validators": [{"toolName": "validate_all"}],
      "promptFile": "prompts/generate_sequence_diagram.md"
    },
    {
      "name": "generate_architecture_diagram",
      "description": "Generate a Mermaid C4 container/component diagram",
      "chain": ["system_design_base"],
      "dependencies": ["validate_all", "system:read", "system:write"],
      "validators": [{"toolName": "validate_all"}],
      "promptFile": "prompts/generate_architecture_diagram.md"
    },
    {
      "name": "generate_class_specification",
      "description": "Produce complete C++ class declarations for every component",
      "chain": ["system_design_base"],
      "dependencies": ["system:read", "system:write"],
      "promptFile": "prompts/generate_class_specification.md"
    },
    {
      "name": "generate_manim_animation",
      "description": "Generate a self-contained Python Manim animation script",
      "chain": ["system_design_base"],
      "dependencies": ["system:write"],
      "promptFile": "prompts/generate_manim_animation.md"
    },
    {
      "name": "generate_d3_animation",
      "description": "Generate a self-contained D3.js HTML animation as an executable consistency check",
      "chain": ["system_design_base"],
      "dependencies": ["extract_artifacts", "test_artifacts", "verify_artifact", "system:read", "system:write"],
      "validators": [{"toolName": "test_artifacts"}, {"toolName": "verify_artifact"}],
      "promptFile": "prompts/generate_d3_animation.md"
    },
    {
      "name": "generate_testing_plan",
      "description": "Produce a structured testing plan covering unit, integration, and E2E tests",
      "chain": ["system_design_base"],
      "dependencies": ["system:read", "system:write"],
      "promptFile": "prompts/generate_testing_plan.md"
    },
    {
      "name": "generate_from_source",
      "description": "Multi-phase bottom-up spec tree generation from source files",
      "chain": ["system_design_base"],
      "dependencies": ["extract_artifacts", "test_artifacts", "system:glob", "system:read", "system:write", "system:grep"],
      "promptFile": "prompts/generate_from_source.md"
    },
    {
      "name": "generate_technical_specification",
      "description": "Produce the complete top-level technical-specification.md",
      "chain": ["system_design_base"],
      "dependencies": ["validate_all", "system:read", "system:write"],
      "validators": [{"toolName": "validate_all"}],
      "promptFile": "prompts/generate_technical_specification.md"
    },
    {
      "name": "revise_technical_specification",
      "description": "Propose structured revisions to the technical specification",
      "chain": ["system_design_base"],
      "dependencies": ["system:read", "system:write"],
      "promptFile": "prompts/revise_technical_specification.md"
    },
    {
      "name": "split_sub_modules",
      "description": "Break a monolithic spec into sub-modules",
      "chain": ["system_design_base"],
      "dependencies": ["validate_all", "system:read", "system:write"],
      "promptFile": "prompts/split_sub_modules.md"
    },
    {
      "name": "combine_sub_modules",
      "description": "Flatten sub-module specs back to a monolithic document",
      "chain": ["system_design_base"],
      "dependencies": ["system:read", "system:write"],
      "promptFile": "prompts/combine_sub_modules.md"
    },
    {
      "name": "list_sub_modules",
      "description": "List all sub-modules with facade classes and spec paths",
      "chain": ["system_design_base"],
      "dependencies": [],
      "promptFile": "prompts/list_sub_modules.md"
    },
    {
      "name": "load_sub_module_spec",
      "description": "Load a sub-module spec into the active specification's knowledge",
      "chain": ["system_design_base"],
      "dependencies": ["system:read"],
      "promptFile": "prompts/load_sub_module_spec.md"
    },
    {
      "name": "generate_sub_module_spec",
      "description": "Generate a .spec.md file for a named sub-module",
      "chain": ["system_design_base"],
      "dependencies": ["extract_artifacts", "test_artifacts", "system:read", "system:write"],
      "promptFile": "prompts/generate_sub_module_spec.md"
    },
    {
      "name": "list_external",
      "description": "List external integration pairs in external/",
      "chain": ["system_design_base"],
      "dependencies": ["system:glob", "system:read"],
      "promptFile": "prompts/list_external.md"
    },
    {
      "name": "load_external",
      "description": "Load an external project's spec tree into context",
      "chain": ["system_design_base"],
      "dependencies": ["system:glob", "system:read"],
      "promptFile": "prompts/load_external.md"
    },
    {
      "name": "staleness_check",
      "description": "Check for specs with missing or outdated reviews",
      "chain": ["system_design_base"],
      "dependencies": ["check_artifacts"],
      "promptFile": "prompts/staleness_check.md"
    }
  ]
}
