{
  "name": "edit",
  "version": "1.0.0",
  "description": "Built-in text replacement tool",
  "tools": [
    {
      "name": "edit",
      "description": "Performs exact string replacements in files.\n\nUsage:\n- You must use your `Read` tool at least once in the conversation before editing. This tool will error if you attempt an edit without reading the file.\n- When editing text from Read tool output, ensure you preserve the exact indentation (tabs/spaces) as it appears AFTER the line number prefix.\n- ALWAYS prefer editing existing files in the codebase. NEVER write new files unless explicitly required.\n- Only use emojis if the user explicitly requests it. Avoid adding emojis to files unless asked.\n- The edit will FAIL if `oldString` is not found in the file with an error \"oldString not found in content\".\n- The edit will FAIL if `oldString` is found multiple times in the file with an error \"Found multiple matches for oldString.\"\n- Use `replaceAll` for replacing and renaming strings across the file.",
      "systemTool": true
    }
  ],
  "prompts": []
}
