{
  "name": "glob",
  "version": "1.0.0",
  "description": "Built-in file pattern matching tool",
  "tools": [
    {
      "name": "glob",
      "description": "Fast file pattern matching tool that works with any codebase size.\n- Supports glob patterns like \"**/*.js\" or \"src/**/*.ts\"\n- Returns matching file paths sorted by modification time\n- Use this tool when you need to find files by name patterns\n- When you are doing an open-ended search that may require multiple rounds of globbing and grepping, use the Task tool instead\n- You have the capability to call multiple tools in a single response. It is always better to speculatively perform multiple searches as a batch that are potentially useful.",
      "systemTool": true
    }
  ],
  "prompts": []
}
