{
  "name": "write",
  "version": "1.0.0",
  "description": "Built-in file writing tool",
  "tools": [
    {
      "name": "write",
      "description": "Writes a file to the local filesystem.\n\nUsage:\n- This tool will overwrite the existing file if there is one at the provided path.\n- If this is an existing file, you MUST use the Read tool first to read the file's contents. This tool will fail if you did not read the file first.\n- ALWAYS prefer editing existing files in the codebase. NEVER write new files unless explicitly required.\n- NEVER proactively create documentation files (*.md) or README files. Only create documentation files if explicitly requested by the User.\n- Only use emojis if the user explicitly requests it. Avoid writing emojis to files unless asked.",
      "systemTool": true
    }
  ],
  "prompts": []
}
